{
  "$schema": "http://json-schema.org/draft-07/schema#",
  "title": "Atlas DataFlow Dataset Published Profile Snapshot",
  "description": "Deterministic public presentation state produced by a Publish Changes operation from a validated dataset public profile draft (contracts/dataset-public-profile.schema.json). This schema is presentation state, not contract, model, metric, inference, release, or registry authority. It must never carry runtime contract fields, trained model data, calculated metrics, inference bundle contents, or registry/release identity beyond dataset_slug and active_release_at_publish_time -- those remain owned by their own canonical artifacts. One snapshot file exists per dataset_slug; publishing again replaces it deterministically (with a backup of the previous snapshot kept alongside it), not as a growing history.",
  "type": "object",
  "required": ["schema_version", "dataset_slug", "published_at", "active_release_at_publish_time", "profile"],
  "additionalProperties": false,
  "not": {
    "anyOf": [
      {"required": ["contract"]},
      {"required": ["runtime_contract"]},
      {"required": ["public_contract"]},
      {"required": ["model"]},
      {"required": ["model_card"]},
      {"required": ["metrics"]},
      {"required": ["features"]},
      {"required": ["validation_rules"]},
      {"required": ["inference_bundle"]},
      {"required": ["registry"]},
      {"required": ["release_manifest"]},
      {"required": ["active_release"]},
      {"required": ["snapshot"]},
      {"required": ["publishing"]}
    ]
  },
  "properties": {
    "schema_version": {
      "type": "string",
      "pattern": "^\\d+\\.\\d+\\.\\d+$",
      "title": "Snapshot Schema Version",
      "description": "Semantic version of this published snapshot schema structure in MAJOR.MINOR.PATCH format. Required. Independent from contracts/dataset-public-profile.schema.json's own schema_version."
    },
    "dataset_slug": {
      "type": "string",
      "pattern": "^[a-z0-9]+(?:-[a-z0-9]+)*$",
      "minLength": 1,
      "title": "Dataset Slug",
      "description": "Primary identity of the dataset this published snapshot applies to. Must match the registry slug pattern. Carried from the registry -- do not encode local paths, private names, or alternate routing semantics in this field."
    },
    "published_at": {
      "type": "string",
      "format": "date-time",
      "title": "Published At",
      "description": "UTC timestamp of the publish operation that created or replaced this snapshot. Used, together with dataset_slug, to make the snapshot explicitly identifiable and deterministic without requiring a separate history store."
    },
    "active_release_at_publish_time": {
      "type": "string",
      "pattern": "^release-(?:[0-9]{8}-[0-9]{3}|[0-9]{8}t[0-9]{6}z)$",
      "title": "Active Release At Publish Time",
      "description": "The dataset's registry active_release identifier at the moment of publish, recorded for traceability only. This is a reference, not a copy of release artifact content, and must never be treated as this snapshot's own release authority."
    },
    "source_draft_schema_version": {
      "type": "string",
      "pattern": "^\\d+\\.\\d+\\.\\d+$",
      "title": "Source Draft Schema Version",
      "description": "Optional schema_version of the draft profile (contracts/dataset-public-profile.schema.json) that was validated and published into this snapshot, recorded for traceability only."
    },
    "profile": {
      "$ref": "#/definitions/profile",
      "title": "Published Presentation Profile",
      "description": "The validated presentation state published from the draft. Field vocabulary matches contracts/dataset-public-profile.schema.json's display/home_card/theme/inference_presentation/result_card definitions exactly; this snapshot never introduces its own presentation field vocabulary."
    },
    "_example_note": {
      "type": "string",
      "description": "Optional annotation for example or demonstration artifacts only. Omit in production snapshot records."
    }
  },
  "definitions": {
    "profile": {
      "type": "object",
      "additionalProperties": false,
      "description": "The published presentation fields, reusing the draft schema's own field vocabulary and constraints exactly.",
      "properties": {
        "display": {
          "$ref": "#/definitions/display"
        },
        "home_card": {
          "$ref": "#/definitions/home_card"
        },
        "performance_focus": {
          "$ref": "#/definitions/performance_focus"
        },
        "theme": {
          "$ref": "#/definitions/theme"
        },
        "inference_presentation": {
          "$ref": "#/definitions/inference_presentation"
        },
        "result_card": {
          "$ref": "#/definitions/result_card"
        }
      }
    },
    "display": {
      "type": "object",
      "additionalProperties": false,
      "description": "Optional curated public-facing copy for the dataset. All fields are presentation text or presentation-format labels only and must not carry validation rules, technical metadata, or business logic.",
      "properties": {
        "title": {
          "type": "string",
          "minLength": 1,
          "description": "Optional curated public display title, overriding the default dataset title for presentation purposes only."
        },
        "subtitle": {
          "type": "string",
          "minLength": 1,
          "description": "Optional curated public subtitle."
        },
        "problem_summary_title": {
          "type": "string",
          "minLength": 1,
          "description": "Optional curated heading for the public problem-summary section."
        },
        "problem_summary_body": {
          "type": "string",
          "minLength": 1,
          "description": "Optional curated public-safe explanatory text for the problem-summary section."
        },
        "source_name": {
          "type": "string",
          "minLength": 1,
          "description": "Optional public-safe label naming the dataset's original source."
        },
        "source_url": {
          "type": "string",
          "format": "uri",
          "description": "Optional public-safe URL for the dataset's original source."
        },
        "release_date_label": {
          "type": "string",
          "format": "date",
          "pattern": "^\\d{4}-\\d{2}-\\d{2}$",
          "description": "Optional public release date projected from the canonical Dataset Detail timestamp and normalized to YYYY-MM-DD."
        },
        "release_date_mode": {
          "type": "string",
          "enum": ["auto", "manual"],
          "description": "Deprecated compatibility field for existing snapshots. New snapshots omit it and it has no date-authority semantics."
        },
        "date_format": {
          "type": "string",
          "enum": ["dd/mm/yyyy", "mm/dd/yyyy", "yyyy-mm-dd"],
          "description": "Optional selected display format for date-shaped labels in this profile."
        },
        "canonical_name_fallback": {
          "type": "boolean",
          "description": "Optional flag indicating whether the public experience should fall back to the canonical dataset name when no curated title is set."
        }
      }
    },
    "home_card": {
      "type": "object",
      "additionalProperties": false,
      "description": "Optional curated Home card presentation metadata. Fields are presentation-only and must not duplicate or redefine technical dataset identity, metrics, or model behavior.",
      "properties": {
        "icon": {
          "type": "string",
          "enum": ["telecom", "bank", "generic", "telecom-users", "bank-building", "chart-line", "heart", "shopping-cart", "airplane", "shield", "education-cap", "energy-bolt", "home-house", "agro-leaf", "logistics-truck", "factory", "weather-cloud", "database", "money-dollar", "globe", "flask", "cpu-chip"],
          "description": "Optional selected Home card icon."
        },
        "background_image_ref": {
          "type": ["string", "null"],
          "minLength": 1,
          "maxLength": 256,
          "pattern": "^/media/[A-Za-z0-9_-]+(?:/[A-Za-z0-9_-]+)*\\.(?:avif|gif|jpeg|jpg|png|webp)$",
          "description": "Optional same-origin public /media/... image reference. Filesystem paths, traversal segments, arbitrary URLs, query strings, and fragments are rejected."
        },
        "short_description": {
          "type": "string",
          "minLength": 1,
          "description": "Optional curated short public-safe description shown on the Home card."
        },
        "primary_metric_key": {
          "type": ["string", "null"],
          "minLength": 1,
          "description": "Optional reference to a metric name/key that may exist in the dataset's release metrics evaluation data."
        }
      }
    },
    "performance_focus": {
      "type": "object",
      "additionalProperties": false,
      "required": ["focus_id", "highlighted_score_id", "visible_scores"],
      "description": "Published curated performance presentation; never canonical metric authority.",
      "properties": {
        "focus_id": {
          "type": "string",
          "enum": ["overall_discrimination", "positive_class_detection", "balanced_classification", "probability_quality", "operational_decision"]
        },
        "highlighted_score_id": {
          "type": "string",
          "minLength": 1,
          "pattern": "^[a-z][a-z0-9]*(?:_[a-z0-9]+)*$"
        },
        "visible_scores": {
          "type": "array",
          "minItems": 1,
          "maxItems": 10,
          "items": {"$ref": "#/definitions/performance_score"}
        }
      }
    },
    "performance_score": {
      "type": "object",
      "additionalProperties": false,
      "required": ["score_id", "display_label", "value", "value_source", "order"],
      "properties": {
        "score_id": {"type": "string", "pattern": "^[a-z][a-z0-9]*(?:_[a-z0-9]+)*$"},
        "display_label": {"type": "string", "minLength": 1, "maxLength": 64, "pattern": "^[A-Za-z0-9][A-Za-z0-9 @'().+/-]*$"},
        "value": {"type": "string", "minLength": 1, "maxLength": 32, "pattern": "^[+-]?(?:[0-9]+(?:\\.[0-9]+)?|\\.[0-9]+)(?:%|[eE][+-]?[0-9]+)?$"},
        "value_source": {"type": "string", "enum": ["canonical", "manual"]},
        "order": {"type": "integer", "minimum": 0, "maximum": 99}
      }
    },
    "theme": {
      "type": "object",
      "additionalProperties": false,
      "description": "Optional selected visual theme preset for the dataset's public presentation.",
      "properties": {
        "preset": {
          "type": "string",
          "enum": [
            "atlas-green",
            "ocean-blue",
            "violet-insight",
            "amber-signal",
            "slate-ops",
            "rose-review",
            "teal-flow",
            "indigo-lab",
            "graphite",
            "citrus",
            "coral",
            "skyline",
            "plum",
            "neutral-light",
            "midnight-cyan",
            "emerald-noir",
            "solar-flare",
            "electric-magenta",
            "neon-lime",
            "aurora",
            "deep-sea",
            "desert-sand",
            "forest-moss",
            "ice-blue",
            "crimson-night",
            "copper-circuit",
            "lavender-mist",
            "monochrome-dark",
            "retro-terminal",
            "cyber-neon"
          ],
          "description": "Optional selected theme preset identifier from the controlled frontend catalog."
        }
      }
    },
    "inference_presentation": {
      "type": "object",
      "additionalProperties": false,
      "description": "Optional reference-only binding from this snapshot to an existing predict view customization record.",
      "properties": {
        "bound_predict_view_id": {
          "type": ["string", "null"],
          "pattern": "^[a-z0-9]+(?:-[a-z0-9]+)*$",
          "description": "Optional reference to an existing predict view's view_id."
        }
      }
    },
    "result_card": {
      "description": "Binary Result Card presentation only. Canonical snapshots use binary-result-presentation.v1; the legacy alternative is deprecated read compatibility.",
      "oneOf": [
        {"$ref": "#/definitions/canonical_result_card"},
        {"$ref": "#/definitions/legacy_result_card"}
      ]
    },
    "canonical_result_card": {
      "type": "object",
      "required": ["schema_version", "positive_class_probability_label", "predicted_outcome_label", "positive_outcome_copy", "negative_outcome_copy", "model_section_label", "interpretation"],
      "additionalProperties": false,
      "properties": {
        "schema_version": {"const": "binary-result-presentation.v1"},
        "positive_class_probability_label": {"$ref": "#/definitions/result_card_short_copy"},
        "predicted_outcome_label": {"$ref": "#/definitions/result_card_short_copy"},
        "positive_outcome_copy": {"$ref": "#/definitions/result_card_outcome_copy"},
        "negative_outcome_copy": {"$ref": "#/definitions/result_card_outcome_copy"},
        "model_section_label": {"$ref": "#/definitions/result_card_short_copy"},
        "interpretation": {"$ref": "#/definitions/result_card_interpretation"}
      }
    },
    "legacy_result_card": {
      "type": "object",
      "additionalProperties": false,
      "description": "Deprecated read compatibility for historical snapshots. New publications never persist these keys.",
      "properties": {
        "probability_label": {
          "type": "string",
          "minLength": 1,
          "maxLength": 160,
          "pattern": "\\S",
          "description": "Deprecated label mapped only to positive_class_probability_label."
        },
        "submit_button_label": {
          "type": "string",
          "minLength": 1,
          "maxLength": 80,
          "pattern": "\\S",
          "description": "Deprecated, read-only compatibility field for existing snapshots. The submit action is now owned by contracts/predict-view-customization.schema.json's view_copy.submit_button_label; new publications must not set this field, and it is retained only as a temporary migration-era read fallback."
        },
        "model_label": {
          "type": "string",
          "minLength": 1,
          "maxLength": 160,
          "pattern": "\\S",
          "description": "Deprecated section copy mapped only to model_section_label; never technical model identity."
        },
        "badge_preset": {
          "type": "string",
          "enum": ["risk"],
          "description": "Optional selected result badge interpretation preset."
        },
        "badge_labels": {
          "$ref": "#/definitions/badge_labels"
        }
      }
    },
    "badge_labels": {
      "type": "object",
      "additionalProperties": false,
      "description": "Optional curated public-safe labels for result badge levels.",
      "properties": {
        "high": {
          "type": "string",
          "minLength": 1,
          "maxLength": 80,
          "pattern": "\\S",
          "description": "Optional curated label for the high badge level."
        },
        "medium": {
          "type": "string",
          "minLength": 1,
          "maxLength": 80,
          "pattern": "\\S",
          "description": "Optional curated label for the medium badge level."
        },
        "low": {
          "type": "string",
          "minLength": 1,
          "maxLength": 80,
          "pattern": "\\S",
          "description": "Optional curated label for the low badge level."
        }
      }
    },
    "result_card_short_copy": {
      "type": "string", "minLength": 1, "maxLength": 160, "pattern": "\\S"
    },
    "result_card_outcome_copy": {
      "type": "string", "minLength": 1, "maxLength": 500, "pattern": "\\S"
    },
    "result_card_interpretation": {
      "type": "object", "required": ["preset", "labels"], "additionalProperties": false,
      "properties": {"preset": {"const": "risk"}, "labels": {"$ref": "#/definitions/canonical_badge_labels"}}
    },
    "canonical_badge_labels": {
      "type": "object", "required": ["high", "medium", "low"], "additionalProperties": false,
      "properties": {
        "high": {"type": "string", "minLength": 1, "maxLength": 80, "pattern": "\\S"},
        "medium": {"type": "string", "minLength": 1, "maxLength": 80, "pattern": "\\S"},
        "low": {"type": "string", "minLength": 1, "maxLength": 80, "pattern": "\\S"}
      }
    }
  }
}
